dex_id,version_id,dex_entry
109,10,"Its thin, balloon-like body is inflated by horribly toxic gases. It reeks when it is nearby."
109,11,"Because it stores several kinds of toxic gases in its body, it is prone to exploding without warning."
109,12,"Lighter-than-air gases in its body keep it aloft. The gases not only smell, they are also explosive."
109,15,"Its thin, filmy body is filled with gases that cause constant sniffles, coughs and teary eyes."
109,16,"The poisonous gases it contains are a little bit lighter than air, keeping it slightly airborne."
109,21,"Toxic gas is held within its thin, balloon-shaped body, so it can cause massive explosions."
109,25,"If Koffing becomes agitated, it raises the toxicity of its internal gases and jets them out from all over its body. This Pokémon may also overinflate its round body, then explode."
109,26,"Koffing embodies toxic substances. It mixes the toxins with raw garbage to set off a chemical reaction that results in a terribly powerful poison gas. The higher the temperature, the more gas is concocted by this Pokémon."
109,31,"In hot places, its internal gases could expand and explode without any warning. Be very careful!"
109,33,"Its body is full of poisonous gas. It floats into garbage dumps, seeking out the fumes of raw, rotting trash."
109,34,It adores polluted air. Some claim that Koffing used to be more plentiful in the Galar region than they are now.
110,1,"Where two kinds of poison gases meet, 2 KOFFINGscan fuse into a WEEZING over many years."
110,3,"It lives and grows by absorbing dust, germs and poisongases that are contained in toxic waste and garbage."
110,4,"If one of the twin KOFFING inflates, the other onedeflates. It con­ stantly mixes its poisonous gases."
110,5,Top-grade perfume is made using its internal poisongases by diluting them to the high­ est level.
110,6,"When it inhales poisonous gases from garbage, itsbody expands, and its insides smell much worse."
110,7,"WEEZING loves the gases given off by rotted kitchen garbage. This POKéMON will find a dirty, unkempt house andmake it its home. At night, when the people in the house are asleep, it will go through the trash."
110,8,"WEEZING alternately shrinks and inflates its twin bodies to mix together toxic gases inside.The more the gases are mixed, the more powerful the toxins become. The POKéMON also becomes more putrid."
110,9,"By diluting its toxic gases with a special process, the highest grade of perfume can be extracted. To WEEZING, gases emanating from garbage are the ultimate feast."
110,10,"Very rarely, a sudden mutation can result in two small KOFFING twins becoming conjoined as a WEEZING."
110,11,"Where two kinds of poison gases meet, two KOFFING can fuse into a WEEZING over many years."
110,12,"It grows by feeding on gases released by garbage. Though very rare, triplets have been found."
110,15,"If one of the twin KOFFING inflates, the other one deflates. It constantly mixes its poisonous gases."
110,16,Top-grade perfume is made using its internal poison gases by diluting them to the highest level.
110,21,Inhaling toxic fumes from trash and mixing them inside its body lets it spread an even fouler stench.
110,23,"If one of the twin Koffing inflates, the other one deflates. It constantly mixes its poisonous gases."
110,24,"Very rarely, a sudden mutation can result in two small Koffing twins becoming conjoined as a Weezing."
110,25,"Weezing loves the gases given off by rotted kitchen garbage. This Pokémon will find a dirty, unkempt house and make it its home. At night, when the people in the house are asleep, it will go through the trash."
110,26,"Weezing alternately shrinks and inflates its twin bodies to mix together toxic gases inside. The more the gases are mixed, the more powerful the toxins become. The Pokémon also becomes more putrid."
110,31,"This Pokémon lives and grows by absorbing poison gas, dust, and germs that exist inside garbage."
110,33,It mixes gases between its two bodies. It’s said that these Pokémon were seen all over the Galar region back in the day.
110,34,"It can’t suck in air quite as well as a Galarian Weezing, but the toxins it creates are more potent than those of its counterpart."
111,1,Its massive bones are 1000 times harder than humanbones. It can easily knock a trailer flying.
111,3,"A POKéMON with a one-track mind. Once it charges, it won't stop running until it falls asleep."
111,4,It is inept at turning because of its four shortlegs. It can only charge and run in one direction.
111,5,It doesn't care if there is anything in its way. Itjust charges and destroys all ob­ stacles.
111,6,"It can remember only one thing at a time. Once itstarts rushing, it forgets why it started."
111,7,"RHYHORN runs in a straight line, smashing everything in its path. It is not bothered even if it rushesheadlong into a block of steel. This POKéMON may feel some pain from the collision the next day, however."
111,8,"RHYHORN’s brain is very small. It is so dense, while on a run it forgets why it started running in the first place.It apparently remembers sometimes if it demolishes something."
111,9,"Once it starts running, it doesn’t stop. Its tiny brain makes it so stupid that it can’t remember why it started running in the first place."
111,10,"Strong, but not too bright, this POKéMON can shatter even a skyscraper with its charging TACKLES."
111,11,"Its massive bones are 1,000 times harder than human bones. Its TACKLE can knock a semitrailer flying."
111,12,"Its body is clad in a thick hide, and its tackles topple buildings. Unfortunately, it is not smart."
111,14,"Its powerful tackles can destroy anything. However, it is too slow witted to help people work."
111,15,It is inept at turning because of its four short legs. It can only charge and run in one direction.
111,16,It doesn’t care if there is anything in its way. It just charges and destroys all obstacles.
111,23,"Strong, but not too bright, this Pokémon can shatter even a skyscraper with its charging Tackles."
111,25,"Rhyhorn runs in a straight line, smashing everything in its path. It is not bothered even if it rushes headlong into a block of steel. This Pokémon may feel some pain from the collision the next day, however."
111,26,"Rhyhorn’s brain is very small. It is so dense, while on a run it forgets why it started running in the first place. It apparently remembers sometimes if it demolishes something."
111,31,"A Pokémon with a one-track mind. Once it charges, it won’t stop running until it falls asleep."
111,33,"Strong, but not too bright, this Pokémon can shatter even a skyscraper with its charging tackles."
111,34,"It can remember only one thing at a time. Once it starts rushing, it forgets why it started."
112,1,"Protected by an armor-like hide, it is capable ofliving in molten lava of 3,600 degrees."
112,3,Walks on its hind legs. Shows signs of intelligence.Its armor-like hide even repels molten lava.
112,4,"Its rugged hide protects it from even the heat oflava. However, the hide also makes it insensitive."
112,5,Its brain devel­ oped when it began walking on hindlegs. Its thick hide protects it even in magma.
112,6,"By lightly spin­ ning its drill- like horn, it caneasily shatter even a diamond in the rough."
112,7,RHYDON’s horn can crush even uncut diamonds. One sweeping blow of its tail can topple a building.This POKéMON’s hide is extremely tough. Even direct cannon hits don’t leave a scratch.
112,8,"RHYDON has a horn that serves as a drill. It is used for destroying rocks and boulders.This POKéMON occasionally rams into streams of magma, but the armor-like hide prevents it from feeling the heat."
112,9,"Its horn, which rotates like a drill, destroys tall buildings with one strike. It stands on its hind legs, and its brain is well developed."
112,10,It begins walking on its hind legs after evolution. It can punch holes through boulders with its horn.
112,11,"Protected by an armor-like hide, it is capable of living in molten lava of 3,600 degrees Fahrenheit."
112,12,Its brain developed after it stood up on its hind legs. Its drill horn bores tunnels through solid rock.
112,14,"Standing on its hind legs freed its forelegs and made it smarter. It is very forgetful, however."
112,15,"Its rugged hide protects it from even the heat of lava. However, the hide also makes it insensitive."
112,16,Its brain developed when it began walking on hind legs. Its thick hide protects it even in magma.
112,25,Rhydon’s horn can crush even uncut diamonds. One sweeping blow of its tail can topple a building. This Pokémon’s hide is extremely tough. Even direct cannon hits don’t leave a scratch.
112,26,"Rhydon has a horn that serves as a drill. It is used for destroying rocks and boulders. This Pokémon occasionally rams into streams of magma, but the armor-like hide prevents it from feeling the heat."
112,31,Its brain developed when it began walking on its hind legs. Its armor-like hide even repels molten lava.
113,1,A rare and elusive POKéMON that is said to bringhappiness to those who manage to get it.
113,3,A gentle and kind­ hearted POKéMON that shares itsnutritious eggs if it sees an injured POKéMON.
113,4,"It walks carefully to prevent its egg from breaking.However, it is extremely fast at running away."
113,5,"Few in number and difficult to cap­ ture, it is saidto bring happiness to the trainer who catches it."
113,6,"People try to catch it for its extremelynutritious eggs, but it rarely can be found."
113,7,"CHANSEY lays nutritionally excellent eggs on an everyday basis. The eggs are so delicious, they areeasily and eagerly devoured by even those people who have lost their appetite."
113,9,"CHANSEY lay nutritionally excellent eggs every day. The eggs are so delicious, they are eagerly devoured by even those people who have lost their appetite."
113,10,It lays several eggs a day. The eggs are apparently rich in nutrients and extremely delicious.
113,11,A rare and elusive POKéMON that is said to bring happiness to those who manage to catch one.
113,12,"It is said to deliver happiness. Being compassionate, it shares its eggs with injured people."
113,13,It lays several eggs a day and won’t share them with those who have evil in their hearts.
113,14,A kindly Pokémon that lays highly nutritious eggs and shares them with injured Pokémon or people.
113,15,"It walks carefully to prevent its egg from breaking. However, it is extremely fast at running away."
113,16,"Being few in number and difficult to capture, it is said to bring happiness to the Trainer who catches it."
113,25,"Chansey lays nutritionally excellent eggs on an everyday basis. The eggs are so delicious, they are easily and eagerly devoured by even those people who have lost their appetite."
113,27,The eggs laid by Chansey are rich in nutrients and a favorite food of many Pokémon.
113,28,"Not only are these Pokémon fast runners, they’re also few in number, so anyone who finds one must be lucky indeed."
113,29,"It seems that other Pokémon’s efforts to take its delicious, nutritious egg away from it caused Chansey to get faster at fleeing."
113,30,"Because the eggs on their bellies have been overharvested by people in the past, the Chansey population remains very small."
113,31,A gentle and kindhearted Pokémon that shares its nutritious eggs if it sees an injured Pokémon.
113,33,The egg Chansey carries is not only delicious but also packed with nutrition. It’s used as a high-class cooking ingredient.
113,34,"This species was once very slow. To protect their eggs from other creatures, these Pokémon became able to flee quickly."
114,1,The whole body is swathed with wide vines that aresimilar to sea­ weed. Its vines shake as it walks.
114,3,"Its identity is obscured by masses of thick, bluevines. The vines are said to never stop growing."
114,4,The vines that cloak its entire body are alwaysjiggling. They effectively un­ nerve its foes.
114,5,It tangles any moving thing with its vines. Theirsubtle shaking is ticklish if you get ensnared.
114,6,"During battle, it constantly moves the vines thatcover its body in order to annoy its opponent."
114,7,"TANGELA’s vines snap off easily if they are grabbed. This happens without pain, allowing it to make a quick getaway.The lost vines are replaced by newly grown vines the very next day."
114,9,"Its vines snap off easily and painlessly if they are grabbed, allowing it to make a quick getaway. The lost vines are replaced by new growth the very next day."
114,10,Blue plant vines cloak the POKéMON’s identity in a tangled mass. It entangles anything that gets close.
114,11,The whole body is swathed with wide vines that are similar to seaweed. The vines sway as it walks.
114,12,It is shrouded by blue vines. No one has seen the face hidden behind this growth of vines.
114,14,The blue vines shrouding its body are covered in a growth of fine hair. It is known to be ticklish.
114,15,The vines that cloak its entire body are always jiggling. They effectively unnerve its foes.
114,16,It tangles any moving thing with its vines. Their subtle shaking is ticklish if you get ensnared.
114,21,"Many writhing vines cover it, so its true identity remains unknown. The blue vines grow its whole life long."
114,25,"Tangela’s vines snap off easily if they are grabbed. This happens without pain, allowing it to make a quick getaway. The lost vines are replaced by newly grown vines the very next day."
114,31,Its identity is obscured by masses of thick blue vines. The vines are said to never stop growing.
114,33,"Hidden beneath a tangle of vines that grows nonstop even if the vines are torn off, this Pokémon’s true appearance remains a mystery."
114,34,"The vines of a Tangela have a distinct scent. In some parts of Galar, Tangela vines are used as herbs."
115,1,The infant rarely ventures out of its mother'sprotective pouch until it is 3 years old.
115,3,Raises its young in its belly pouch. Won't runfrom any fight to keep its young protected.
115,4,"If it is safe, the young gets out of the belly pouch toplay. The adult keeps a close eye on the youngster."
115,5,"To protect its young, it will never give upduring battle, no matter how badly wounded it is."
115,6,"To avoid crushing the baby it carries inits pouch, it always sleeps standing up."
115,7,"If you come across a young KANGASKHAN playing by itself, you must never disturb it or attempt to catch it.The baby POKéMON’s parent is sure to be in the area, and it will become violently enraged at you."
115,9,"If you come across a young KANGASKHAN playing by itself, never try to catch it. The baby’s parent is sure to be in the area, and it will become violently enraged."
115,10,The female raises its offspring in a pouch on its belly. It is skilled at attacking using COMET PUNCH.
115,11,The infant rarely ventures out of its mother’s protective pouch until it is three years old.
115,12,It raises its offspring in its belly pouch. It lets the baby out to play only when it feels safe.
115,15,"If it is safe, the young gets out of the belly pouch to play. The adult keeps a close eye on the youngster."
115,16,"To protect its young, it will never give up during battle, no matter how badly wounded it is."
115,25,"If you come across a young Kangaskhan playing by itself, you must never disturb it or attempt to catch it. The baby Pokémon’s parent is sure to be in the area, and it will become violently enraged at you."
115,27,Kangaskhan’s maternal love is so deep that it will brave death to protect its offspring.
115,28,The child in its pouch leaves home after roughly three years. That is the only time the mother is heard to cry wildly.
115,29,Kangaskhan protects its child by keeping it in its pouch. It has zero forgiveness for those who harm its child and will beat them down.
115,30,You shouldn’t get close to the child when it’s playing outside its mother’s pouch. Its mother is always nearby watching over it.
115,31,Raises its young in its belly pouch. Won’t run from any fight to keep its young protected.
115,33,"Although it’s carrying its baby in a pouch on its belly, Kangaskhan is swift on its feet. It intimidates its opponents with quick jabs."
115,34,There are records of a lost human child being raised by a childless Kangaskhan.
116,1,Known to shoot down flying bugs with precisionblasts of ink from the surface of the water.
116,3,"If it senses any danger, it will vigorously spraywater or a special type of ink from its mouth."
116,4,"If attacked by a larger enemy, it quickly swims tosafety by adeptly controlling its dorsal fin."
116,5,"Its big, developed fins move rapidly, allowing it toswim backward while still facing forward."
116,6,"When they're in a safe location, they can be seenplayfully tangling their tails together."
116,7,"HORSEA eats small insects and moss off of rocks. If the ocean current turns fast, this POKéMON anchors itself bywrapping its tail around rocks or coral to prevent being washed away."
116,8,"If HORSEA senses danger, it will reflexively spray a dense black ink from its mouth and try to escape.This POKéMON swims by cleverly flapping the fins on its back."
116,9,"By cleverly flicking the fins on its back side to side, it moves in any direction while facing forward. It spits ink to escape if it senses danger."
116,10,"It maintains balance using its tail, which is wound up like a coil. It may spray ink from its mouth."
116,11,Known to shoot down flying bugs with precision blasts of ink from the surface of the water.
116,12,"It makes its nest in the shade of corals. If it senses danger, it spits murky ink and flees."
116,15,"If attacked by a larger enemy, it quickly swims to safety by adeptly controlling its well-developed dorsal fin."
116,16,"Its big, developed fins move rapidly, allowing it to swim backward while still facing forward."
116,25,"Horsea eats small insects and moss off of rocks. If the ocean current turns fast, this Pokémon anchors itself by wrapping its tail around rocks or coral to prevent being washed away."
116,26,"If Horsea senses danger, it will reflexively spray a dense black ink from its mouth and try to escape. This Pokémon swims by cleverly flapping the fin on its back."
116,31,"If it senses any danger, it will vigorously spray water or a special type of ink from its mouth."
116,33,"Horsea makes its home in oceans with gentle currents. If this Pokémon is under attack, it spits out pitch-black ink and escapes."
116,34,They swim with dance-like motions and cause whirlpools to form. Horsea compete to see which of them can generate the biggest whirlpool.
117,1,Capable of swim­ ming backwards by rapidly flappingits wing-like pectoral fins and stout tail.
117,3,Touching the back fin causes numb­ ness. It hooksits tail to coral to stay in place while sleeping.
117,4,An examination of its cells revealed the presence of agene not found in HORSEA. It became a hot topic.
117,5,Its fin-tips leak poison. Its fins and bones arehighly valued as ingredients in herbal medicine.
117,6,"The male raises the young. If it is approached, ituses its toxic spikes to fend off the intruder."
117,7,SEADRA sleeps after wriggling itself between the branches of coral. Those trying to harvest coral areoccasionally stung by this POKéMON’s poison barbs if they fail to notice it.
117,8,"SEADRA generates whirlpools by spinning its body. The whirlpools are strong enough to swallow even fishing boats.This POKéMON weakens prey with these currents, then swallows it whole."
117,9,The poisonous barbs all over its body are highly valued as ingredients for making traditional herbal medicine. It shows no mercy to anything approaching its nest.
117,10,Its body bristles with sharp spikes. Carelessly trying to touch it could cause fainting from the spikes.
117,11,It is capable of swimming backwards by rapidly flapping its winglike pectoral fins and stout tail.
117,12,Its spines provide protection. Its fins and bones are prized as traditional medicine ingredients.
117,15,An examination of its cells revealed the presence of a gene not found in HORSEA. It became a hot topic.
117,16,Its fin-tips leak poison. Its fins and bones are highly valued as ingredients in herbal medicine.
117,21,Its spines provide protection. Its fins and bones are prized as traditional-medicine ingredients.
117,25,Seadra sleeps after wriggling itself between the branches of coral. Those trying to harvest coral are occasionally stung by this Pokémon’s poison barbs if they fail to notice it.
117,26,"Seadra generates whirlpools by spinning its body. The whirlpools are strong enough to swallow even fishing boats. This Pokémon weakens prey with these currents, then swallows it whole."
117,31,Touching the back fin causes numbness. It hooks its tail to coral to stay in place while sleeping.
117,33,"It’s the males that raise the offspring. While Seadra are raising young, the spines on their backs secrete thicker and stronger poison."
117,34,"Seadra’s mouth is slender, but its suction power is strong. In an instant, Seadra can suck in food that’s larger than the opening of its mouth."
118,1,"Its tail fin billows like an elegant ballroomdress, giving it the nickname of the Water Queen."
118,3,"When it is time for them to lay eggs, they can beseen swimming up rivers and falls in large groups."
118,4,"Its dorsal, pecto­ ral and tail fins wave elegantly inwater. That is why it is known as the water dancer."
118,5,"A strong swimmer, it is capable of swimming nonstopup fast streams at a steady speed of five knots."
118,6,"During spawning season, they swim gracefully in thewater, searching for their perfect mate."
118,7,"GOLDEEN is a very beautiful POKéMON with fins that billow elegantly in water. However, don’t let your guard downaround this POKéMON - it could ram you powerfully with its horn."
118,8,"GOLDEEN loves swimming wild and free in rivers and ponds. If one of these POKéMON is placed in anaquarium, it will shatter even the thickest glass with one ram of its horn and make its escape."
118,9,"In the springtime, schools of GOLDEEN can be seen swimming up falls and rivers. It metes out staggering damage with its single horn."
118,10,Its dorsal and pectoral fins are strongly developed like muscles. It can swim at a speed of five knots.
118,11,"Its tail fin billows like an elegant ballroom dress, giving it the nickname of “The Water Queen.”"
118,12,It swims elegantly by flittering its tail fin as if it were a dress. It has the look of a queen.
118,13,"It swims at a steady 5 knots. If it senses danger, it will strike back with its sharp horn."
118,14,"Though it appears very elegant when swimming with fins unfurled, it can jab powerfully with its horn."
118,15,"Its dorsal, pectoral and tail fins wave elegantly in water. That is why it is known as the water dancer."
118,16,"A strong swimmer, it is capable of swimming nonstop up fast streams at a steady speed of five knots per hour."
118,24,"Its dorsal, pectoral, and tail fins wave elegantly in water. That is why it is known as the water dancer."
118,25,"Goldeen is a very beautiful Pokémon with fins that billow elegantly in water. However, don’t let your guard down around this Pokémon—it could ram you powerfully with its horn."
118,26,"Goldeen loves swimming wild and free in rivers and ponds. If one of these Pokémon is placed in an aquarium, it will shatter even the thickest glass with one ram of its horn and make its escape."
118,27,"When the weather grows warm, they form groups and swim upriver. This sight serves as a poetic reminder that spring has arrived."
118,28,"Spellbound by the length of its horn and the beauty of its fins, many strange Trainers raise Goldeen and nothing but Goldeen."
118,29,"Although known for their splendid tail fins, Goldeen apparently compete among themselves to see whose horn is thickest and sharpest."
118,30,The way it swims along fluttering its dress-like fins has earned it the name “princess of the water.”
118,31,"When it is time for them to lay eggs, they can be seen swimming up rivers and falls in large groups."
118,33,"Its dorsal, pectoral, and tail fins wave elegantly in water. That is why it is known as the Water Dancer."
119,1,"In the autumn spawning season, they can be seenswimming power­ fully up rivers and creeks."
119,3,It is the male's job to make a nest by carvingout boulders in a stream using the horn on its head.
119,4,"During spawning season, SEAKING gather from allover, coloring the rivers a brilliant red."
119,5,"Using its horn, it bores holes in riverbed boulders,making nests to prevent its eggs from washing away."
119,6,"When autumn comes, the males patrol the area aroundtheir nests in order to protect their offspring."
119,7,"In the autumn, SEAKING males can be seen performing courtship dances in riverbeds to woo females.During this season, this POKéMON’s body coloration is at its most beautiful."
119,8,SEAKING is very protective of its eggs. The male and female will take turns patrolling around their nest and eggs.The guarding of eggs by these POKéMON goes on for over a month.
119,9,It punches holes in boulders on stream­ beds. This is a clever innovation that prevents its eggs from being attacked or washed away by the current.
119,10,The horn on its head is sharp like a drill. It bores a hole in a boulder to make its nest.
119,11,"In the autumn spawning season, they can be seen swimming powerfully up rivers and creeks."
119,12,It makes its nest by hollowing out boulders in streams with its horn. It defends its eggs with its life.
119,13,"To protect its family, it will fight with its drill-sharp horn. It lives in hollowed rocks in streams."
119,14,"In autumn, its body becomes more fatty in preparing to propose to a mate. It takes on beautiful colors."
