dex_id,version_id,dex_entry
1,1,A strange seed was planted on its back at birth.The plant sprouts and grows with this POKéMON.
1,3,"It can go for days without eating a single morsel.In the bulb on its back, it stores energy."
1,4,The seed on its back is filled with nutrients.The seed grows steadily larger as its body grows.
1,5,"It carries a seed on its back right from birth. As itgrows older, the seed also grows larger."
1,6,"While it is young, it uses the nutrients that arestored in the seeds on its back in order to grow."
1,7,"BULBASAUR can be seen napping in bright sunlight. There is a seed on its back.By soaking up the sun’s rays, the seed grows progressively larger."
1,9,"BULBASAUR can be seen napping in bright sunlight. There is a seed on its back. By soaking up the sun’s rays, the seed grows progressively larger."
1,10,There is a plant seed on its back right from the day this POKéMON is born. The seed slowly grows larger.
1,11,A strange seed was planted on its back at birth. The plant sprouts and grows with this POKéMON.
1,12,"For some time after its birth, it grows by gaining nourishment from the seed on its back."
1,15,The seed on its back is filled with nutrients. The seed grows steadily larger as its body grows.
1,16,"It carries a seed on its back right from birth. As it grows older, the seed also grows larger."
1,23,A strange seed was planted on its back at birth. The plant sprouts and grows with this Pokémon.
1,25,"Bulbasaur can be seen napping in bright sunlight. There is a seed on its back. By soaking up the sun’s rays, the seed grows progressively larger."
1,31,"It can go for days without eating a single morsel. In the bulb on its back, it stores energy."
1,33,There is a plant seed on its back right from the day this Pokémon is born. The seed slowly grows larger.
1,34,"While it is young, it uses the nutrients that are stored in the seed on its back in order to grow."
2,1,"When the bulb on its back grows large, it appearsto lose the ability to stand on its hind legs."
2,3,The bulb on its back grows by drawing energy.It gives off an aroma when it is ready to bloom.
2,4,Exposure to sun­ light adds to its strength. Sunlightalso makes the bud on its back grow larger.
2,5,"If the bud on its back starts to smell sweet, itis evidence that the large flower will soon bloom."
2,6,The bulb on its back grows as it absorbs nutrients.The bulb gives off a pleasant aroma when it blooms.
2,7,"There is a bud on this POKéMON’s back. To support its weight, IVYSAUR’s legs and trunk grow thick and strong.If it starts spending more time lying in the sunlight, it’s a sign that the bud will bloom into a large flower soon."
2,9,"To support its bulb, IVYSAUR’s legs grow sturdy. If it spends more time lying in the sunlight, the bud will soon bloom into a large flower."
2,10,"There is a plant bulb on its back. When it absorbs nutrients, the bulb is said to blossom into a large flower."
2,11,"When the bulb on its back grows large, it appears to lose the ability to stand on its hind legs."
2,12,"When the bud on its back starts swelling, a sweet aroma wafts to indicate the flower’s coming bloom."
2,15,Exposure to sunlight adds to its strength. Sunlight also makes the bud on its back grow larger.
2,16,"If the bud on its back starts to smell sweet, it is evidence that the large flower will soon bloom."
2,25,"There is a bud on this Pokémon’s back. To support its weight, Ivysaur’s legs and trunk grow thick and strong. If it starts spending more time lying in the sunlight, it’s a sign that the bud will bloom into a large flower soon."
2,31,The bud on its back grows by drawing energy. It gives off an aroma when it is ready to bloom.
3,1,The plant blooms when it is absorbing solarenergy. It stays on the move to seek sunlight.
3,3,The flower on its back catches the sun's rays.The sunlight is then absorbed and used for energy.
3,4,"By spreading the broad petals of its flower andcatching the sun's rays, it fills its body with power."
3,5,"It is able to con­ vert sunlight into energy. As aresult, it is more powerful in the summertime."
3,6,"As it warms it­ self and absorbs the sunlight, itsflower petals release a pleasant fragrance."
3,7,There is a large flower on VENUSAUR’s back. The flower is said to take on vivid colors if it gets plenty of nutritionand sunlight. The flower’s aroma soothes the emotions of people.
3,9,VENUSAUR’s flower is said to take on vivid colors if it gets plenty of nutrition and sunlight. The flower’s aroma soothes the emotions of people.
3,10,A bewitching aroma wafts from its flower. The fragrance becalms those engaged in a battle.
3,11,Its plant blooms when it is absorbing solar energy. It stays on the move to seek sunlight.
3,12,"After a rainy day, the flower on its back smells stronger. The scent attracts other Pokémon."
3,15,"By spreading the broad petals of its flower and catching the sun’s rays, it fills its body with power."
3,16,"It is able to convert sunlight into energy. As a result, it is more powerful in the summertime."
3,25,There is a large flower on Venusaur’s back. The flower is said to take on vivid colors if it gets plenty of nutrition and sunlight. The flower’s aroma soothes the emotions of people.
3,31,The flower on its back catches the sun’s rays. The sunlight is then absorbed and used for energy.
4,1,"Obviously prefers hot places. When it rains, steamis said to spout from the tip of its tail."
4,3,The flame at the tip of its tail makes a sound asit burns. You can only hear it in quiet places.
4,4,"The flame on its tail shows the strength of itslife force. If it is weak, the flame also burns weakly."
4,5,"The flame on its tail indicates CHARMANDER's lifeforce. If it is healthy, the flame burns brightly."
4,6,"If it's healthy, the flame on the tip of its tailwill burn vigor­ ously, even if it gets a bit wet."
4,7,"The flame that burns at the tip of its tail is an indication of its emotions. The flame wavers when CHARMANDER isenjoying itself. If the POKéMON becomes enraged, the flame burns fiercely."
4,9,"The flame that burns at the tip of its tail is an indication of its emotions. The flame wavers when CHARMANDER is happy, and blazes when it is enraged."
4,10,"From the time it is born, a flame burns at the tip of its tail. Its life would end if the flame were to go out."
4,11,"It has a preference for hot things. When it rains, steam is said to spout from the tip of its tail."
4,12,"The fire on the tip of its tail is a measure of its life. If healthy, its tail burns intensely."
4,15,"The flame on its tail shows the strength of its life force. If it is weak, the flame also burns weakly."
4,16,"The flame on its tail indicates CHARMANDER’s life force. If it is healthy, the flame burns brightly."
4,23,"The flame on its tail indicates Charmander’s life force. If it is healthy, the flame burns brightly."
4,25,"The flame that burns at the tip of its tail is an indication of its emotions. The flame wavers when Charmander is enjoying itself. If the Pokémon becomes enraged, the flame burns fiercely."
4,31,The flame at the tip of its tail makes a sound as it burns. You can only hear it in quiet places.
5,1,"When it swings its burning tail, it elevates thetemperature to unbearably high levels."
5,3,"Tough fights could excite this POKéMON. Whenexcited, it may blow out bluish- white flames."
5,4,"It is very hot­ headed by nature, so it constantlyseeks opponents. It calms down only when it wins."
5,5,"It has a barbaric nature. In battle, it whips itsfiery tail around and slashes away with sharp claws."
5,6,"If it becomes agitated during battle, it spoutsintense flames, incinerating its surroundings."
5,7,"CHARMELEON mercilessly destroys its foes using its sharp claws. If it encounters a strong foe, it turnsaggressive. In this excited state, the flame at the tip of its tail flares with a bluish white color."
5,9,"Without pity, its sharp claws destroy foes. If it encounters a strong enemy, it becomes agitated, and the flame on its tail flares with a bluish white color."
5,10,It lashes about with its tail to knock down its foe. It then tears up the fallen opponent with sharp claws.
5,11,"When it swings its burning tail, it elevates the air temperature to  unbearably high levels."
5,12,"In the rocky mountains where CHARMELEON live, their fiery tails shine at night like stars."
5,15,"It is very hotheaded by nature, so it constantly seeks opponents. It calms down only when it wins."
5,16,"It has a barbaric nature. In battle, it whips its fiery tail around and slashes away with sharp claws."
5,17,"In the rocky mountains where Charmeleon live, their fiery tails shine at night like stars."
5,24,"When it swings its burning tail, it elevates the air temperature to unbearably high levels."
5,25,"Charmeleon mercilessly destroys its foes using its sharp claws. If it encounters a strong foe, it turns aggressive. In this excited state, the flame at the tip of its tail flares with a bluish white color."
5,31,"Tough fights could excite this Pokémon. When excited, it may breathe out bluish-white flames."
5,34,"If it becomes agitated during battle, it spouts intense flames, incinerating its surroundings."
6,1,Spits fire that is hot enough to melt boulders.Known to cause forest fires unintentionally.
6,3,"When expelling a blast of super hot fire, the redflame at the tip of its tail burns more intensely."
6,4,"If CHARIZARD be­ comes furious, the flame at the tipof its tail flares up in a whitish- blue color."
6,5,"Breathing intense, hot flames, it can melt almost any­thing. Its breath inflicts terrible pain on enemies."
6,6,It uses its wings to fly high. The temperature of itsfire increases as it gains exper­ ience in battle.
6,7,"CHARIZARD flies around the sky in search of powerful opponents. It breathes fire of such great heatthat it melts anything. However, it never turns its fiery breath on any opponent weaker than itself."
6,9,"A CHARIZARD flies about in search of strong opponents. It breathes intense flames that can melt any material. However, it will never torch a weaker foe."
6,10,"Its wings can carry this POKéMON close to an altitude of 4,600 feet. It blows out fire at very high temperatures."
6,11,It spits fire that is hot enough to melt boulders. It may cause forest fires by blowing flames.
6,12,It is said that CHARIZARD’s fire burns hotter if it has experienced harsh battles.
6,15,"If CHARIZARD becomes furious, the flame at the tip of its tail flares up in a light blue shade."
6,16,"Breathing intense, hot flames, it can melt almost anything. Its breath inflicts terrible pain on enemies."
6,17,It is said that Charizard’s fire burns hotter if it has experienced harsh battles.
6,23,"When expelling a blast of superhot fire, the red flame at the tip of its tail burns more intensely."
6,24,"Its wings can carry this Pokémon close to an altitude of 4,600 feet. It blows out fire at very high temperatures."
6,25,"Charizard flies around the sky in search of powerful opponents. It breathes fire of such great heat that it melts anything. However, it never turns its fiery breath on any opponent weaker than itself."
6,31,"When this Pokémon expels a blast of superhot fire, the red flame at the tip of its tail burns more intensely."
7,1,"After birth, its back swells and hardens into ashell. Powerfully sprays foam from its mouth."
7,3,Shoots water at prey while in the water.Withdraws into its shell when in danger.
7,4,"The shell is soft when it is born. It soon becomes soresilient, prod­ ding fingers will bounce off it."
7,5,"The shell, which hardens soon after it is born, isresilient. If you poke it, it will bounce back out."
7,6,"When it feels threatened, it draws its legsinside its shell and sprays water from its mouth."
7,7,"SQUIRTLE’s shell is not merely used for protection. The shell’s rounded shape and thegrooves on its surface help minimize resistance in water, enabling this POKéMON to swim at high speeds."
7,9,"Its shell is not just for protection. Its rounded shape and the grooves on its surface minimize resistance in water, enabling SQUIRTLE to swim at high speeds."
7,10,"When it retracts its long neck into its shell, it squirts out water with vigorous force."
7,11,"After birth, its back swells and hardens into a shell. It powerfully sprays foam  from its mouth."
7,12,"It shelters itself in its shell, then strikes back with spouts of water at every opportunity."
7,15,"The shell is soft when it is born. It soon becomes so resilient, prodding fingers will bounce off it."
7,16,"The shell, which hardens soon after it is born, is resilient. If you poke it, it will bounce back out."
7,21,It shelters itself in its shell then strikes back with spouts of water at every opportunity.
7,24,Shoots water at prey while in the water. Withdraws into its shell when in danger.
7,25,"Squirtle’s shell is not merely used for protection. The shell’s rounded shape and the grooves on its surface help minimize resistance in water, enabling this Pokémon to swim at high speeds."
7,34,"When it feels threatened, it draws its limbs inside its shell and sprays water from its mouth."
8,1,"Often hides in water to stalk unwary prey. Forswimming fast, it moves its ears to maintain balance."
8,3,"When tapped, this POKéMON will pull in its head, butits tail will still stick out a little bit."
8,4,"It is recognized as a symbol of longevity. If itsshell has algae on it, that WARTORTLE is very old."
8,5,It cleverly con­ trols its furry ears and tail tomaintain its balance while swimming.
8,6,"Its long, furry tail is a symbol of longevity,making it quite popular among older people."
8,7,"Its tail is large and covered with a rich, thick fur. The tail becomes increasingly deeper in color as WARTORTLE ages.The scratches on its shell are evidence of this POKéMON’s toughness as a battler."
8,9,"Its large tail is covered with rich, thick fur that deepens in color with age. The scratches on its shell are evidence of this POKéMON’s toughness in battle."
8,10,This POKéMON is very popular as a pet. Its fur-covered tail is a symbol of its longevity.
8,11,"It often hides in water to stalk unwary prey. For fast swimming, it moves its ears to maintain balance."
8,12,"It is said to live 10,000 years. Its furry tail is popular as a symbol of longevity."
8,15,"It is a well-established symbol of longevity. If its shell has algae on it, that WARTORTLE is very old."
8,16,It cleverly controls its furry ears and tail to maintain its balance while swimming.
8,23,"When tapped, this Pokémon will pull in its head, but its tail will still stick out a little bit."
8,25,"Its tail is large and covered with a rich, thick fur. The tail becomes increasingly deeper in color as Wartortle ages. The scratches on its shell are evidence of this Pokémon’s toughness as a battler."
8,31,"When tapped on its head, this Pokémon will pull it in, but its tail will still stick out a little bit."
8,33,"It is recognized as a symbol of longevity. If its shell has algae on it, that Wartortle is very old."
9,1,A brutal POKéMON with pressurized water jets on itsshell. They are used for high speed tackles.
9,3,"Once it takes aim at its enemy, it blasts out waterwith even more force than a fire hose."
9,4,It deliberately makes itself heavy so it can with­stand the recoil of the water jets it fires.
9,5,The rocket cannons on its shell fire jets of watercapable of punch­ ing holes through thick steel.
9,6,It firmly plants its feet on the ground beforeshooting water from the jets on its back.
9,7,BLASTOISE has water spouts that protrude from its shell. The water spouts are very accurate.They can shoot bullets of water with enough accuracy to strike empty cans from a distance of over 160 feet.
9,9,The waterspouts that protrude from its shell are highly accurate. Their bullets of water can precisely nail tin cans from a distance of over 160 feet.
9,10,"It crushes its foe under its heavy body to cause fainting. In a pinch, it will withdraw inside its shell."
9,11,The pressurized water jets on this brutal POKéMON’s shell are used for high- speed tackles.
9,12,The jets of water it spouts from the rocket cannons on its shell can punch through thick steel.
9,15,It deliberately makes itself heavy so it can withstand the recoil of the water jets it fires.
9,16,The rocket cannons on its shell fire jets of water capable of punching holes through thick steel.
9,24,The pressurized water jets on this brutal Pokémon’s shell are used for high-speed tackles.
9,25,Blastoise has water spouts that protrude from its shell. The water spouts are very accurate. They can shoot bullets of water with enough accuracy to strike empty cans from a distance of over 160 feet.
9,31,"Once it takes aim at its enemy, it blasts out water with even more force than a fire hose."
10,1,Its short feet are tipped with suction pads thatenable it to tirelessly climb slopes and walls.
10,3,"If you touch the feeler on top of its head, it willrelease a horrible stink to protect itself."
10,4,"For protection, it releases a horri­ ble stench fromthe antenna on its head to drive away enemies."
10,5,Its feet have suction cups designed to stickto any surface. It tenaciously climbs trees to forage.
10,6,It crawls into foliage where it camouflages itselfamong leaves that are the same color as its body.
10,7,"CATERPIE has a voracious appetite. It can devour leaves bigger than its body right before your eyes.From its antenna, this POKéMON releases a terrifically strong odor."
10,9,Its voracious appetite compels it to devour leaves bigger than itself without hesitation. It releases a terribly strong odor from its antennae.
10,10,"It is covered with a green skin. When it grows, it sheds the skin, covers itself with silk, and becomes a cocoon."
10,11,Its short feet are tipped with suction pads that enable it to tirelessly climb slopes and walls.
10,12,It releases a stench from its red antenna to repel enemies. It grows by molting repeatedly.
10,15,"For protection, it releases a horrible stench from the antennae on its head to drive away enemies."
10,16,Its feet have suction cups designed to stick to any surface. It tenaciously climbs trees to forage.
10,25,"Caterpie has a voracious appetite. It can devour leaves bigger than its body right before your eyes. From its antenna, this Pokémon releases a terrifically strong odor."
10,27,"When attacked by bird Pokémon, it resists by releasing a terrifically strong odor from its antennae, but it often becomes their prey."
10,28,"It’s easy to catch, and it grows quickly, making it one of the top recommendations for novice Pokémon Trainers."
10,29,"Perhaps because it would like to grow up quickly, it has a voracious appetite, eating a hundred leaves a day."
10,30,"Its body is soft and weak. In nature, its perpetual fate is to be seen by others as food."
10,31,"If you touch the feeler on top of its head, it will release a horrible stink to protect itself."
10,33,"For protection, it releases a horrible stench from the antenna on its head to drive away enemies."
11,1,"This POKéMON is vulnerable to attack while itsshell is soft, exposing its weak and tender body."
11,3,"Hardens its shell to protect itself. However, a largeimpact may cause it to pop out of its shell."
11,4,"Inside the shell, it is soft and weak as it pre­pares to evolve. It stays motion­ less in the shell."
11,5,It prepares for evolution by har­ dening its shellas much as possi­ ble to protect its soft body.
11,6,"This is its pre- evolved form. At this stage, it canonly harden, so it remains motionless to avoid attack."
11,7,The shell covering this POKéMON’s body is as hard as an iron slab. METAPOD does not move very much.It stays still because it is preparing its soft innards for evolution inside the hard shell.
11,9,Its shell is as hard as an iron slab. A METAPOD does not move very much because it is preparing its soft innards for evolution inside the shell.
11,10,"Even though it is encased in a sturdy shell, the body inside is tender. It can’t withstand a harsh attack."
11,11,"This POKéMON is vulnerable to attack while its shell is soft, exposing its weak and tender body."
11,12,A steel-hard shell protects its tender body. It quietly endures hardships while awaiting evolution.
11,15,"Inside the shell, it is soft and weak as it prepares to evolve. It stays motionless in the shell."
11,16,It prepares for evolution by hardening its shell as much as possible to protect its soft body.
11,24,"This Pokémon is vulnerable to attack while its shell is soft, exposing its weak and tender body."
11,25,The shell covering this Pokémon’s body is as hard as an iron slab. Metapod does not move very much. It stays still because it is preparing its soft innards for evolution inside the hard shell.
11,27,Its shell is filled with its soft innards. It doesn’t move much because of the risk it might carelessly spill its innards out.
11,28,"Its shell is hard, but it’s still just a bug shell. It’s been known to break, so intense battles with it should be avoided."
11,29,Its shell is filled with a thick liquid. All of the cells throughout its body are being rebuilt in preparation for evolution.
11,30,"Its hard shell doesn’t crack a bit even if Pikipek pecks at it, but it will tip over, spilling out its insides."
11,31,"Hardens its shell to protect itself. However, a large impact may cause it to pop out of its shell."
11,33,"It is waiting for the moment to evolve. At this stage, it can only harden, so it remains motionless to avoid attack."
12,1,"In battle, it flaps its wings at high speed torelease highly toxic dust into the air."
12,3,"Its wings, covered with poisonous powders, repelwater. This allows it to fly in the rain."
12,4,It collects honey every day. It rubs honey onto thehairs on its legs to carry it back to its nest.
12,5,"Water-repellent powder on its wings enables itto collect honey, even in the heav­ iest of rains."
12,6,"It flits from flower to flower, collecting honey.It can even identify distant flowers in bloom."
12,7,"BUTTERFREE has a superior ability to search for delicious honey from flowers.It can even search out, extract, and carry honey from flowers that are blooming over six miles from its nest."
12,9,"It has a superior ability to search for delicious honey from flowers. It can seek, extract, and carry honey from flowers blooming over six miles away."
12,10,"The wings are protected by rain-repellent dust. As a result, this POKéMON can fly about even in rain."
12,11,"In battle, it flaps its wings at great speed to release highly toxic dust into the air."
12,12,It loves the honey of flowers and can locate flower patches that have even tiny amounts of pollen.
12,15,It collects honey every day. It rubs honey onto the hairs on its legs to carry it back to its nest.
12,16,"Water-repellent powder on its wings enables it to collect honey, even in the heaviest of rains."
12,24,"The wings are protected by rain-repellent dust. As a result, this Pokémon can fly about even in rain."
12,25,"Butterfree has a superior ability to search for delicious honey from flowers. It can even search out, extract, and carry honey from flowers that are blooming over six miles from its nest."
12,27,Close examination of its large eyes reveals that each eye is composed of a myriad of tiny eyes.
12,28,"When attacked by other Pokémon, it defends itself by scattering its poisonous scales and fluttering its wings."
12,29,"Its wings are covered in toxic scales. If it finds bird Pokémon going after Caterpie, Butterfree sprinkles its scales on them to drive them off."
12,30,"Nectar from pretty flowers is its favorite food. In fields of flowers, it has heated battles with Cutiefly for territory."
12,31,"Its wings, covered with poisonous powder, repel water. This allows it to fly in the rain."
13,1,"Often found in forests, eating leaves.It has a sharp venomous stinger on its head."
13,3,Beware of the sharp stinger on its head. Ithides in grass and bushes where it eats leaves.
13,4,Its poison stinger is very powerful. Its bright-coloredbody is intended to warn off its enemies.
13,5,It attacks using a two-inch poison barb on its head.It can usually be found under the leaves it eats.
13,6,The barb on top of its head secretes a strong poison.It uses this toxic barb to protect itself.
13,7,WEEDLE has an extremely acute sense of smell. It is capable of distinguishing itsfavorite kinds of leaves from those it dislikes just by sniffing with its big red proboscis (nose).
13,9,A WEEDLE has an extremely acute sense of smell. It distinguishes its favorite kinds of leaves from those it dislikes by sniffing with its big red proboscis (nose).
13,10,"Often found in forests and grasslands. It has a sharp, toxic barb of around two inches on top of its head."
13,11,"Often found in forests, eating leaves. It has a sharp stinger on its head that injects poison."
13,12,It eats its weight in leaves every day. It fends off attackers with the needle on its head.
13,15,Its poison stinger is very powerful. Its bright-colored body is intended to warn off its enemies.
13,16,It attacks using a two-inch poison barb on its head. It can usually be found under the leaves it eats.
13,25,Weedle has an extremely acute sense of smell. It is capable of distinguishing its favorite kinds of leaves from those it dislikes just by sniffing with its big red proboscis (nose).
13,31,Beware of the sharp stinger on its head. It hides in grass and bushes where it eats leaves.
14,1,"Almost incapable of moving, this POKéMON can onlyharden its shell to protect itself from predators."
14,3,"Able to move only slightly. When endangered, itmay stick out its stinger and poison its enemy."
14,4,"Although it is a cocoon, it can move a little. Itcan extend its poison barb if it is attacked."
