dex_id,version_id,dex_entry
46,9,A PARAS has parasitic tochukaso mushrooms growing on its back. They grow by drawing nutrients from the host. They are valued as a medicine for long life.
46,10,Growing out of the bug’s back are mushrooms called tochukaso. The mushrooms grow with the bug host.
46,11,Burrows to suck tree roots. The mushrooms on its back grow by drawing nutrients from the bug host.
46,12,Mushrooms named tochukaso grow on its back. They grow along with the host PARAS.
46,15,"It is doused with mushroom spores when it is born. As its body grows, mushrooms sprout from its back."
46,16,"As its body grows, large mushrooms named tochukaso start sprouting out of its back."
46,17,Mushrooms named tochukaso grow on its back. They grow along with the host Paras.
46,24,Burrows under the ground to gnaw on tree roots. The mushrooms on its back absorb most of the nutrition.
46,25,Paras has parasitic mushrooms growing on its back called tochukaso. They grow large by drawing nutrients from this Bug Pokémon host. They are highly valued as a medicine for extending life.
46,27,"No matter how much it eats, the mushrooms growing on its back steal away most of the nutrients it consumes."
46,28,Mushrooms called tochukaso sprout from its back. They can be dried and powdered to make a medicine used to extend life.
46,29,"Whether it’s due to a lack of moisture or a lack of nutrients, in Alola the mushrooms on Paras don’t grow up quite right."
46,30,"The mushrooms, known as tochukaso, are controlling the bug. Even if the bug bugs the mushrooms, they tell it to bug off."
47,1,A host-parasite pair in which the parasite mushroomhas taken over the host bug. Prefers damp places.
47,3,The bug host is drained of energy by the mushroomson its back. They appear to do all the thinking.
47,4,"It stays mostly in dark, damp places, the preference notof the bug, but of the big mush­ rooms on its back."
47,5,"The larger the mushroom on its back grows, thestronger the mush­ room spores it scatters."
47,6,"When nothing's left to extract from the bug, themushrooms on its back leave spores on the bug's egg."
47,7,"PARASECT is known to infest large trees en masse and drain nutrients from the lower trunk and roots.When an infested tree dies, they move onto another tree all at once."
47,9,"PARASECT are known to infest the roots of large trees en masse and drain nutrients. When an infested tree dies, they move onto another tree all at once."
47,10,"It scatters toxic spores from the mushroom cap. In China, the spores are used as herbal medicine."
47,11,A host-parasite pair in which the parasite mushroom has taken over the host bug. Prefers damp places. 
47,12,A mushroom grown larger than the host’s body controls PARASECT. It scatters poisonous spores.
47,13,It is controlled by a mushroom grown larger than the bug body. It is said to prefer damp places.
47,15,"It stays mostly in dark, damp places, the preference not of the bug, but of the big mushroom on its back."
47,16,"The larger the mushroom on its back grows, the stronger the mushroom spores it scatters."
47,17,A mushroom grown larger than the host’s body controls Parasect. It scatters poisonous spores.
47,25,"Parasect is known to infest large trees en masse and drain nutrients from the lower trunk and roots. When an infested tree dies, they move onto another tree all at once."
47,27,The large mushroom on its back controls it. It often fights over territory with Shiinotic.
47,28,"It scatters toxic spores from its mushroom cap. Once harvested, these spores can be steeped and boiled down to prepare herbal medicines."
47,29,"The bug is mostly dead, with the mushroom on its back having become the main body. If the mushroom comes off, the bug stops moving."
47,30,"Its poisonous spores are also used in traditional medicine. Apparently, spores produced in Alola are not of very good quality."
47,31,The bug host is drained of energy by the mushroom on its back. The mushroom appears to do all the thinking.
48,1,Lives in the shadows of tall trees where iteats insects. It is attracted by light at night.
48,3,"Its large eyes act as radars. In a bright place, youcan see that they are clusters of many tiny eyes."
48,4,Its eyes also function as radar units. It catchesand eats small bugs that hide in darkness.
48,5,Poison oozes from all over its body. It catches andeats small bugs at night that are at­ tracted by light.
48,6,"The small bugs it eats appear only at night, so itsleeps in a hole in a tree until night falls."
48,7,"VENONAT is said to have evolved with a coat of thin, stiff hair that covers its entire body for protection.It possesses large eyes that never fail to spot even miniscule prey."
48,9,"Its coat of thin, stiff hair that covers its entire body is said to have evolved for protection. Its large eyes never fail to spot even miniscule prey."
48,10,"Its eyes act as radar, enabling it to be active in darkness. The eyes can also shoot powerful beams."
48,11,Lives in the shadows of tall trees where it eats bugs. It is attracted by light at night.
48,12,"Its big eyes are actually clusters of tiny eyes. At night, its kind is drawn by light."
48,15,Its eyes also function as radar units. It catches and eats small bugs that hide in darkness.
48,16,Poison oozes from all over its body. It catches and eats small bugs at night that are attracted by light.
48,25,"Venonat is said to have evolved with a coat of thin, stiff hair that covers its entire body for protection. It possesses large eyes that never fail to spot even minuscule prey."
48,31,"Its large eyes act as radar. In a bright place, you can see that they are clusters of many tiny eyes."
49,1,The dust-like scales covering its wings arecolor coded to indicate the kinds of poison it has.
49,3,The powdery scales on its wings are hard to remove.They also contain poison that leaks out on contact.
49,4,"When it attacks, it flaps its large wings violently toscatter its poi­ sonous powder all around."
49,5,"The powder on its wings is poisonous if it is dark incolor. If it is light, it causes paralysis."
49,6,"The scales it scatters will paralyze anyonewho touches them, making that person unable to stand."
49,7,"VENOMOTH is nocturnal - it is a POKéMON that only becomes active at night. Its favorite prey are small insectsthat gather around streetlights, attracted by the light in the darkness."
49,9,"VENOMOTH are nocturnal--they only are active at night. Their favorite prey are insects that gather around streetlights, attracted by the light in the darkness."
49,10,"The wings are covered with dustlike scales. Every time it flaps its wings, it looses highly toxic dust."
49,11,The dustlike scales covering its wings are color-coded to indicate the kinds of poison it has.
49,12,It flutters its wings to scatter dustlike scales. The scales leach toxins if they contact skin.
49,15,"When it attacks, it flaps its large wings violently to scatter its poisonous powder all around."
49,16,"The powder on its wings is poisonous if it is dark in hue. If it is light in hue, it causes paralysis."
49,23,"The scales it scatters will paralyze anyone who touches them, making that person unable to stand."
49,25,"Venomoth is nocturnal—it is a Pokémon that only becomes active at night. Its favorite prey are small insects that gather around streetlights, attracted by the light in the darkness."
49,31,The powdery scales on its wings are hard to remove from skin. They also contain poison that leaks out on contact.
50,1,Lives about one yard underground where it feeds onplant roots. It sometimes appears above ground.
50,3,"It prefers dark places. It spends most of its timeunderground, though it may pop up in caves."
50,4,"Its skin is very thin. If it is exposed to light,its blood heats up, causing it to grow weak."
50,5,"If a DIGLETT DIGS through a field, it leaves the soilperfectly tilled and ideal for planting crops."
50,6,"It digs under­ ground and chews on tree roots,sticking its head out only when the sun isn't bright."
50,7,"DIGLETT are raised in most farms. The reason is simple - wherever this POKéMON burrows, the soil is leftperfectly tilled for planting crops. This soil is made ideal for growing delicious vegetables."
50,9,"DIGLETT are raised in most farms. The reason is simple--wherever they burrow, the soil is left perfectly tilled for growing delicious crops."
50,10,"It burrows through the ground at a shallow depth. It leaves raised earth in its wake, making it easy to spot."
50,11,Lives about one yard underground where it feeds on plant roots. It sometimes appears aboveground.
50,12,"A Pokémon that lives underground. Because of its dark habitat, it is repelled by bright sunlight."
50,15,"Its skin is very thin. If it is exposed to light, its blood heats up, causing it to grow weak."
50,16,"If a DIGLETT digs through a field, it leaves the soil perfectly tilled and ideal for planting crops."
50,25,"Diglett are raised in most farms. The reason is simple— wherever this Pokémon burrows, the soil is left perfectly tilled for planting crops. This soil is made ideal for growing delicious vegetables."
50,27,It chews on plant roots underground. Farmers whose vegetables are vulnerable find it can be quite a pest.
50,28,Many farmers cherish and nurture Diglett because its droppings enrich the soil it lives in.
50,29,"It travels through tunnels that it digs underground. It hates sunlight, so it comes out only after the sun goes down."
50,30,"Around their crops, farmers plant the kind of tree that Diglett like to eat as a way of getting Diglett to plow the fields for them."
50,31,"It prefers dark places. It spends most of its time underground, though it may pop up in caves."
50,33,"If a Diglett digs through a field, it leaves the soil perfectly tilled and ideal for planting crops."
51,1,A team of DIGLETT triplets. It triggers hugeearthquakes by burrowing 60 miles underground.
51,3,"A team of triplets that can burrow over 60 MPH.Due to this, some people think it's an earthquake."
51,4,"Its three heads bob separately up and down to loosenthe soil nearby, making it easier for it to burrow."
51,5,"Extremely power­ ful, they can DIG through even thehardest ground to a depth of over 60 miles."
51,6,These DIGLETT triplets dig over 60 miles below sealevel. No one knows what it's like underground.
51,7,"DUGTRIO are actually triplets that emerged from one body. As a result, each triplet thinks exactly like theother two triplets. They work cooperatively to burrow endlessly."
51,9,"Because the triplets originally split from one body, they think exactly alike. They work cooperatively to burrow endlessly through the ground."
51,10,"In battle, it digs through the ground and strikes the unsuspecting foe from an unexpected direction."
51,11,A team of DIGLETT triplets. It triggers huge earthquakes by burrowing 60 miles underground.
51,12,"Its three heads move alternately, driving it through tough soil to depths of over 60 miles."
51,15,"Its three heads bob separately up and down to loosen the soil nearby, making it easier for it to burrow."
51,16,"Extremely powerful, they can dig through even the hardest ground to a depth of over 60 miles."
51,25,"Dugtrio are actually triplets that emerged from one body. As a result, each triplet thinks exactly like the other two triplets. They work cooperatively to burrow endlessly."
51,27,This set of triplets moves cooperatively. It’s the power of teamwork that enables this Pokémon to dig to a depth of 60 miles.
51,28,"Despite the closeness between this Pokémon and farmers and other people, no one has ever seen the parts of it concealed underground."
51,29,"While the three of them normally get along splendidly, on rare occasions a huge fight will break out over which head gets to eat first."
51,30,Dugtrio’s heads are sleek and smooth and incredibly hard. It can dig through any soil with its headbutts.
51,31,A team of triplets that can burrow to a depth of 60 miles. It’s reported that this triggers an earthquake.
51,33,A team of Diglett triplets. It triggers huge earthquakes by burrowing 60 miles underground.
51,34,These Diglett triplets dig over 60 miles below sea level. No one knows what it’s like underground.
52,1,Adores circular objects. Wanders the streets on anightly basis to look for dropped loose change.
52,3,Appears to be more active at night. It loves roundand shiny things. It can't stop from picking them up.
52,4,It is fascinated by round objects. It can't stopplaying with them until it tires and falls asleep.
52,5,It loves anything that shines. It especially adorescoins that it picks up and se­ cretly hoards.
52,6,"It loves things that sparkle. When it sees a shinyobject, the gold coin on its head shines too."
52,7,"MEOWTH withdraws its sharp claws into its paws to slinkily sneak about without making any incriminating footsteps.For some reason, this POKéMON loves shiny coins that glitter with light."
52,9,"MEOWTH withdraw their sharp claws into their paws to silently sneak about. For some reason, this POKéMON loves shiny coins that glitter with light."
52,10,"All it does is sleep during the daytime. At night, it patrols its territory with its eyes aglow."
52,11,Adores round objects. It wanders the streets on a nightly basis to look for dropped loose change.
52,12,"It is nocturnal in nature. If it spots something shiny, its eyes glitter brightly."
52,15,It is fascinated by round objects. It can’t stop playing with them until it tires and falls asleep.
52,16,It loves anything that shines. It especially adores coins that it picks up and secretly hoards.
52,25,"Meowth withdraws its sharp claws into its paws to slinkily sneak about without making any incriminating footsteps. For some reason, this Pokémon loves shiny coins that glitter with light."
52,27,"It lies around all day, becoming active near dusk. At night, it wanders the city in search of loose change."
52,28,It loves shiny things. It often fights with Murkrow over prey they’re both trying to catch.
52,29,"When visiting a junkyard, you may catch sight of it having an intense fight with Murkrow over shiny objects."
52,30,"It loves coins, so if you give it one, you can make friends with Meowth easily. But it’s fickle, so you can’t count on that friendship lasting."
52,31,Appears to be more active at night. It loves round and shiny things. It can’t stop itself from picking them up.
52,33,"It loves to collect shiny things. If it’s in a good mood, it might even let its Trainer have a look at its hoard of treasures."
52,34,It washes its face regularly to keep the coin on its forehead spotless. It doesn’t get along with Galarian Meowth.
53,1,"Although its fur has many admirers, it is tough toraise as a pet because of its fickle meanness."
53,3,The gem in its forehead glows on its own! It walkswith all the grace and elegance of a proud queen.
53,4,"Many adore it for its sophisticated air. However, itwill lash out and scratch for little reason."
53,5,Its lithe muscles allow it to walk without makinga sound. It attacks in an instant.
53,6,"Behind its lithe, elegant appearance lies a barbaricside. It will tear apart its prey on a mere whim."
53,7,PERSIAN has six bold whiskers that give it a look of toughness. The whiskers   sense air movements to determine whatis in the POKéMON’s surrounding vicinity. It becomes docile if grabbed by the whiskers.
53,9,A PERSIAN’s six bold whiskers sense air movements to determine what is in its vicinity. It becomes docile if grabbed by the whiskers.
53,10,Has a vicious temperament. Beware if it raises its tail straight up. It is a signal that it is about to pounce and bite.
53,11,"Although its fur has many admirers, it is tough to raise as a pet because of its fickle meanness."
53,12,"A very haughty Pokémon. Among fans, the size of the jewel in its forehead is a topic of much talk."
53,15,"Many adore it for its sophisticated air. However, it will lash out and scratch for little reason."
53,16,Its lithe muscles allow it to walk without making a sound. It attacks in an instant.
53,25,Persian has six bold whiskers that give it a look of toughness. The whiskers sense air movements to determine what is in the Pokémon’s surrounding vicinity. It becomes docile if grabbed by the whiskers.
53,27,It has a violent temperament. It will attack anything that looks it in the eye. Its sharp claws inflict deep wounds.
53,28,"It has a high opinion of itself, although not to the same extent as the Alolan Persian. It’s quite difficult to make friends with this Pokémon."
53,29,"Although the jewel on its forehead appears to be a different color than those of Alolan Persian, it’s mostly made of the same material."
53,30,This Pokémon is popular with rich people. It’s also targeted by hunters who are after the jewel in its forehead.
53,31,The gem in its forehead glows on its own! It walks with all the grace and elegance of a proud queen.
53,33,"Getting this prideful Pokémon to warm up to you takes a lot of effort, and it will claw at you the moment it gets annoyed."
53,34,Its elegant and refined behavior clashes with that of the barbaric Perrserker. The relationship between the two is one of mutual disdain.
54,1,"While lulling its enemies with its vacant look, thiswily POKéMON will use psychokinetic powers."
54,3,"Always tormented by headaches. It uses psychicpowers, but it is not known if it intends to do so."
54,4,It has mystical powers but doesn't recall that it hasused them. That is why it always looks puzzled.
54,5,"If its chronic headache peaks, it may exhibit oddpowers. It seems unable to recall such an episode."
54,6,The only time it can use its psy­ chic power is whenits sleeping brain cells happen to wake.
54,7,"PSYDUCK uses a mysterious power. When it does so, this POKéMON  generates brain waves that aresupposedly only seen in sleepers. This discovery spurred controversy among scholars."
54,8,"If it uses its mysterious power, PSYDUCK can’t remember having done so. It apparently can’t form a memory ofsuch an event because it goes into an altered state that is much like deep sleep."
54,9,"When its headache intensifies, it starts using strange powers. However, it has no recollection of its powers, so it always looks befuddled and bewildered."
54,10,"It is constantly wracked by a headache. When the headache turns intense, it begins using mysterious powers."
54,11,"While lulling its enemies with its vacant look, this wily POKéMON will use psychokinetic powers."
54,12,"If its usual headache worsens, it starts exhibiting odd powers. It can’t remember doing so, however."
54,13,"It never remembers using its odd powers, so it always tilts its head in puzzlement."
54,14,"Overwhelmed by enigmatic abilities, it suffers a constant headache. It sometimes uses mysterious powers."
54,15,It has mystical powers but doesn’t recall that it has used them. That is why it always looks puzzled.
54,16,"If its chronic headache peaks, it may exhibit odd powers. It seems unable to recall such an episode."
54,21,"When headaches stimulate its brain cells, which are usually inactive, it can use a mysterious power."
54,25,"Psyduck uses a mysterious power. When it does so, this Pokémon generates brain waves that are supposedly only seen in sleepers. This discovery spurred controversy among scholars."
54,26,"If it uses its mysterious power, Psyduck can’t remember having done so. It apparently can’t form a memory of such an event because it goes into an altered state that is much like deep sleep."
54,27,"As a result of headaches so fierce they cause it to cry, it sometimes uses psychokinesis without meaning to."
54,28,"This Pokémon is troubled by constant headaches. The more pain it’s in, the more powerful its psychokinesis becomes."
54,29,"Using psychokinesis gives it a headache, so it normally passes the time spacing out and doing as little as possible."
54,30,It has been found that its brain cells are 10 times more active when Psyduck is experiencing a headache.
54,31,"Always tormented by headaches. It uses psychic powers, but whether it intends to do so is not known."
54,33,"Psyduck is constantly beset by headaches. If the Pokémon lets its strange power erupt, apparently the pain subsides for a while."
54,34,"As Psyduck gets stressed out, its headache gets progressively worse. It uses intense psychic energy to overwhelm those around it."
55,1,"Often seen swim­ ming elegantly by lake shores. Itis often mistaken for the Japanese monster, Kappa."
55,3,Its slim and long limbs end in broad flippers. Theyare used for swim­ ming gracefully in lakes.
55,4,"When it swims at full speed using its long, webbedlimbs, its fore­ head somehow be­ gins to glow."
55,5,It appears by waterways at dusk. It may use tele­kinetic powers if its forehead glows mysteriously.
55,6,"It swims grace­ fully along on the quiet, slow-movingrivers and lakes of which it is so fond."
55,7,The webbed flippers on its forelegs and hind legs and the streamlined body of GOLDUCK give it frightening speed.This POKéMON is definitely much faster than even the most athletic swimmer.
55,8,"GOLDUCK is the fastest swimmer among all POKéMON. It swims effortlessly, even in a rough, stormy sea.It sometimes rescues people from wrecked ships floundering in high seas."
55,9,A GOLDUCK is an adept swimmer. It sometimes joins competitive swimmers in training. It uses psychic powers when its forehead shimmers with light.
55,10,"The forelegs are webbed, helping to make it an adept swimmer. It can be seen swimming elegantly in lakes, etc."
55,11,Often seen swimming elegantly by lakeshores. It is often mistaken for the Japanese monster Kappa.
55,12,A Pokémon that lives in lakes. It swims faster than any human swimming champion.
55,13,The flippers of its well-developed limbs give it shocking speed. It is the best swimmer among Pokémon.
55,14,It is seen swimming dynamically and elegantly using its well-developed limbs and flippers.
55,15,"When it swims at full speed using its long, webbed limbs, its forehead somehow begins to glow."
55,16,It appears by waterways at dusk. It may use telekinetic powers if its forehead glows mysteriously.
55,21,"When its forehead shines mysteriously, Golduck can use the full extent of its power."
55,25,The webbed flippers on its forelegs and hind legs and the streamlined body of Golduck give it frightening speed. This Pokémon is definitely much faster than even the most athletic swimmer.
55,26,"Golduck is the fastest swimmer among all Pokémon. It swims effortlessly, even in a rough, stormy sea. It sometimes rescues people from wrecked ships floundering in high seas."
55,27,"It is said that the red part of its forehead grants supernatural powers to those who possess one, so it was over-hunted in the past."
55,28,It swims along the banks of lakes and catches fish Pokémon. It takes them to the shore and quietly eats them up.
55,29,Even fast-swimming fish Pokémon can be disabled by Golduck. It brings them to a standstill and seizes them.
55,30,"A professional swimmer, it can continue swimming for two days straight by waving its long tail skillfully."
55,31,"Its long, slim limbs end in broad flippers. They are used for swimming gracefully in lakes."
55,33,"This Pokémon lives in gently flowing rivers. It paddles through the water with its long limbs, putting its graceful swimming skills on display."
55,34,Old tales tell of Golduck punishing those that defiled its river. The guilty were dragged into the water and taken away.
56,1,Extremely quick to anger. It could be docile onemoment then thrashing away the next instant.
56,3,An agile POKéMON that lives in trees. It angerseasily and will not hesitate to attack anything.
56,4,It is extremely ill-tempered. Groups of themwill attack any handy target for no reason.
56,5,It's unsafe to ap­ proach if it gets violently enragedfor no reason and can't distinguish friends from foes.
56,6,"It lives in groups in the treetops. If it loses sightof its group, it becomes infuriated by its loneliness."
56,7,"When MANKEY starts shaking and its nasal breathing turns rough, it’s a sure sign that it is becoming angry.However, because it goes into a towering rage almost instantly, it is impossible for anyone to flee its wrath."
56,9,"When it starts shaking and its nasal breathing turns rough, it’s a sure sign of anger. However, since this happens instantly, there is no time to flee."
56,10,"Light and agile on its feet, and ferocious in temperament. When angered, it flies into an uncontrollable frenzy."
56,11,"Extremely quick to anger. It could be docile one moment, then thrashing away  the next instant."
56,12,"It lives in treetop colonies. If one becomes enraged, the whole colony rampages for no reason."
56,15,It is extremely ill-tempered. Groups of them will attack any handy target for no reason.
56,16,It’s unsafe to approach if it gets violently enraged for no reason and can’t distinguish friends from foes.
56,25,"When Mankey starts shaking and its nasal breathing turns rough, it’s a sure sign that it is becoming angry. However, because it goes into a towering rage almost instantly, it is impossible for anyone to flee its wrath."
56,27,"It can spontaneously become enraged. Everyone near it clears out as it rampages, and the resulting loneliness makes it angrier still."
56,28,"Its raging tires it out and causes it to fall asleep, but the anger resonating in its dreams causes it to wake up—which infuriates it all over again."
56,29,"The smallest of things could cause it to lose its temper. Because it doesn’t hold in its stress, this Pokémon can live a long time."
56,30,"If one gets angry, all the others around it will get angry, so silence is a rare visitor in a troop of Mankey."
56,31,An agile Pokémon that lives in trees. It angers easily and will not hesitate to attack anything.
