dex_id,version_id,dex_entry
76,28,"Once a year, this Pokémon molts, and its shed shell returns to the soil. This process creates enriched soil, so farmers collect the shells."
76,29,"When Golem grow old, they stop shedding their shells. Those that have lived a long, long time have shells green with moss."
76,30,It detonates its own body. The power from that explosion can propel it up steep mountain paths with amazing speed.
76,31,"Once it sheds its skin, its body turns tender and whitish. Its hide hardens when it’s exposed to air."
77,1,Its hooves are 10 times harder than diamonds. It cantrample anything completely flat in little time.
77,3,Capable of jumping incredibly high. Its hooves andsturdy legs absorb the impact of a hard landing.
77,4,It is a weak run­ ner immediately after birth. Itgradually becomes faster by chasing after its parents.
77,5,"Its hind legs, which have hard­ er-than-diamondhooves, kick back at any presence it senses behind it."
77,6,Training by jumping over grass that grows longerevery day has made it a world-class jumper.
77,7,PONYTA is very weak at birth. It can barely stand up. This POKéMON becomes stronger bystumbling and falling to keep up with its parent.
77,9,A PONYTA is very weak at birth. It can barely stand up. Its legs become stronger as it stumbles and falls while trying to keep up with its parent.
77,10,"Its body is light, and its legs are incredibly powerful. It can clear Ayers Rock in one leap."
77,11,Its hooves are ten times harder than diamond. It can trample anything completely flat in little time.
77,12,"About an hour after birth, its fiery mane and tail grow out, giving it an impressive appearance."
77,13,Its legs grow strong while it chases after its parent. It runs in fields and mountains all day.
77,14,"As a newborn, it can barely stand. However, through galloping, its legs are made tougher and faster."
77,15,It is a weak runner immediately after birth. It gradually becomes faster by chasing after its parents.
77,16,"Its hind legs, which have hooves that are harder than diamond, kick back at any presence it senses behind it."
77,25,Ponyta is very weak at birth. It can barely stand up. This Pokémon becomes stronger by stumbling and falling to keep up with its parent.
77,31,Capable of jumping incredibly high. Its hooves and sturdy legs absorb the impact of a hard landing.
77,33,"It can’t run properly when it’s newly born. As it races around with others of its kind, its legs grow stronger."
77,34,"If you’ve been accepted by Ponyta, its burning mane is mysteriously no longer hot to the touch."
78,1,"Very competitive, this POKéMON will chase anythingthat moves fast in the hopes of racing it."
78,3,"Just loves to run. If it sees some­ thing faster thanitself, it will give chase at top speed."
78,4,"At full gallop, its four hooves barely touch theground because it moves so incredi­ bly fast."
78,5,"With incredible acceleration, it reaches its topspeed of 150 mph after running just ten steps."
78,6,"It just loves to gallop. The faster it goes, the long­er the swaying flames of its mane will become."
78,7,"RAPIDASH usually can be seen casually cantering in the fields and plains. However, when this POKéMON turnsserious, its fiery manes flare and blaze as it gallops its way up to 150 mph."
78,9,"It usually canters casually in the fields and plains. But once a RAPIDASH turns serious, its fiery manes flare and blaze as it gallops its way up to 150 mph."
78,10,It can gallop at a top speed of 150 miles per hour. It can race as fast as a bullet train while ablaze.
78,11,"Very competitive, this POKéMON will chase anything that moves fast in the hopes of racing it."
78,12,"It gallops at nearly 150 mph. With its mane blazing ferociously, it races as if it were an arrow."
78,13,"It has astounding acceleration. From a standstill, it can reach top speed within 10 steps."
78,14,"When at an all-out gallop, its blazing mane sparkles, enhancing its beautiful appearance."
78,15,"At full gallop, its four hooves barely touch the ground because it moves so incredibly fast."
78,16,"With incredible acceleration, it reaches its top speed of 150 mph after running just 10 steps."
78,23,"Very competitive, this Pokémon will chase anything that moves fast in the hopes of racing it."
78,25,"Rapidash usually can be seen casually cantering in the fields and plains. However, when this Pokémon turns serious, its fiery manes flare and blaze as it gallops its way up to 150 mph."
78,31,"Just loves to run. If it sees something faster than itself, it will give chase at top speed."
78,33,"This Pokémon can be seen galloping through fields at speeds of up to 150 mph, its fiery mane fluttering in the wind."
78,34,"The fastest runner becomes the leader, and it decides the herd’s pace and direction of travel."
79,1,Incredibly slow and dopey. It takes 5 secondsfor it to feel pain when under attack.
79,3,Incredibly slow and sluggish. It is quite contentto loll about without worrying about the time.
79,4,"It lazes vacantly near water. If something bitesits tail, it won't even notice for a whole day."
79,5,"A sweet sap leaks from its tail's tip. Although notnutritious, the tail is pleasant to chew on."
79,6,"It is always so absent-minded that it won't react,even if its flavorful tail is bitten."
79,7,"SLOWPOKE uses its tail to catch prey by dipping it in water at the side of a river.However, this POKéMON often forgets what it’s doing and often spends entire days just loafing at water’s edge."
79,9,It catches prey by dipping its tail in water at the side of a river. But it often forgets what it is doing and spends entire days just loafing at water’s edge.
79,10,"It is always vacantly lost in thought, but no one knows what it is thinking about. It is good at fishing with its tail."
79,11,Incredibly slow and dopey. It takes five seconds for it to feel pain when under attack.
79,12,"Although slow, it is skilled at fishing with its tail. It does not feel pain if its tail is bitten."
79,15,"It lazes vacantly near water. If something bites its tail, it won’t even notice for a whole day."
79,16,"A sweet sap leaks from its tail’s tip. Although not nutritious, the tail is pleasant to chew on."
79,25,"Slowpoke uses its tail to catch prey by dipping it in water at the side of a river. However, this Pokémon often forgets what it’s doing and often spends entire days just loafing at water’s edge."
79,27,"Its long tail often breaks off. It doesn’t really feel any pain, though, and the tail grows back, so Slowpoke isn’t particularly bothered."
79,28,Alolan home cooking involves drying Slowpoke tails and then simmering them into a salty stew.
79,29,"There are some places where Slowpoke is worshiped because of a long-standing belief that whenever Slowpoke yawns, it rains."
79,30,"Although their tails, which fall off naturally, can easily be found lying around, they’re a precious ingredient for cooking."
79,31,Incredibly slow and sluggish. It is quite content to loll about without worrying about the time.
79,33,"Slow-witted and oblivious, this Pokémon won’t feel any pain if its tail gets eaten. It won’t notice when its tail grows back, either."
79,34,"When this Pokémon’s tail is soaked in water, sweetness seeps from it. Slowpoke uses this trait to lure in and fish up other Pokémon."
80,1,The SHELLDER that is latched onto SLOWPOKE's tailis said to feed on the host's left over scraps.
80,3,"Lives lazily by the sea. If the SHELLDER on itstail comes off, it becomes a SLOWPOKE again."
80,4,"If the tail-biting SHELLDER is thrown off in a harshbattle, it reverts to being an ordi­ nary SLOWPOKE."
80,5,"Naturally dull to begin with, it lost its abilityto feel pain due to SHELLDER's seeping poison."
80,6,An attached SHELLDER won't let go because of thetasty flavor that oozes out of its tail.
80,7,"SLOWBRO’s tail has a SHELLDER firmly attached with a bite. As a result, the tail can’t be used for fishing anymore.This causes SLOWBRO to grudgingly swim and catch prey instead."
80,9,"Its tail has a SHELLDER firmly attached with a bite. As a result, the tail can’t be used for fishing anymore. This forces it to reluctantly swim and catch prey."
80,10,"When a SLOWPOKE went hunting in the sea, its tail was bitten by a SHELLDER. That made it evolve into SLOWBRO."
80,11,The SHELLDER that latches onto SLOWPOKE’s tail is said to feed on the host’s leftover scraps.
80,12,"Though usually dim witted, it seems to become inspired if the SHELLDER on its tail bites down."
80,15,"If the tail-biting SHELLDER is thrown off in a harsh battle, it reverts to being an ordinary SLOWPOKE."
80,16,"Naturally dull to begin with, it lost its ability to feel pain due to SHELLDER’s seeping poison."
80,17,"Though usually dim witted, it seems to become inspired if the Shellder on its tail bites down."
80,23,An attached Shellder won’t let go because of the tasty flavor that oozes out of its tail.
80,24,"When a Slowpoke went hunting in the sea, its tail was bitten by a Shellder. That made it evolve into Slowbro."
80,25,"Slowbro’s tail has a Shellder firmly attached with a bite. As a result, the tail can’t be used for fishing anymore. This causes Slowbro to grudgingly swim and catch prey instead."
80,27,"It spaces out while gazing at the sea. With Shellder’s poison flowing through its body, it becomes even spacier."
80,28,"Whenever Shellder bites down hard on its tail, it gives Slowbro a flash of inspiration...which it forgets a moment later."
80,29,"Spacing out is basically all it does. It turns back into Slowpoke if its tail, along with Shellder, breaks off."
80,30,"Shellder, in its greed to suck out more and more sweetness from Slowbro’s tail, has metamorphosed into a spiral-shaped shell."
80,31,"Lives lazily by the sea. If the Shellder on its tail comes off, it becomes a Slowpoke again."
80,33,Slowpoke became Slowbro when a Shellder bit on to its tail. Sweet flavors seeping from the tail make the Shellder feel as if its life is a dream.
80,34,"Being bitten by a Shellder shocked this Pokémon into standing on two legs. If the Shellder lets go, it seems Slowbro will turn back into a Slowpoke."
81,1,Uses anti-gravity to stay suspended. Appears withoutwarning and uses THUNDER WAVE and similar moves.
81,3,It is born with the ability to defy gravity. Itfloats in air on powerful electro­ magnetic waves.
81,4,It is attracted by electromagnetic waves. It mayapproach trainers if they are using their POKéGEAR.
81,5,The units at the sides of its body generate anti­gravity energy to keep it aloft in the air.
81,6,The electricity emitted by the units on each sideof its body cause it to become a strong magnet.
81,7,"MAGNEMITE attaches itself to power lines to feed on electricity. If your house has a power outage,check your circuit breakers. You may find a large number of this POKéMON clinging to the breaker box."
81,8,MAGNEMITE floats in the air by emitting electromagnetic waves from the units at its sides. These waves block gravity.This POKéMON becomes incapable of flight if its internal electrical supply is depleted.
81,9,The units at its sides are extremely powerful magnets. They generate enough magnetism to draw in iron objects from over 300 feet away.
81,10,It moves while constantly hovering. It discharges THUNDER WAVE and so on from the units at its sides.
81,11,Uses antigravity to stay suspended. Appears without warning and uses THUNDER WAVE and similar moves.
81,12,The units at its sides generate electromagnetic waves that keep it airborne. It feeds on electricity.
81,14,"The faster the units at its sides rotate, the greater the magnetic force they generate."
81,15,It is attracted by electromagnetic waves. It may approach Trainers if they are using their Pokégear.
81,16,The units at the sides of its body generate antigravity energy to keep it aloft in the air.
81,21,"The electromagnetic waves emitted by the units at the sides of its head expel antigravity, which allows it to float."
81,24,It moves while constantly hovering. It discharges Thunder Wave and so on from the units at its sides.
81,25,"Magnemite attaches itself to power lines to feed on electricity. If your house has a power outage, check your circuit breakers. You may find a large number of this Pokémon clinging to the breaker box."
81,26,Magnemite floats in the air by emitting electromagnetic waves from the units at its sides. These waves block gravity. This Pokémon becomes incapable of flight if its internal electrical supply is depleted.
81,27,They gather in places where electricity is available. They can be found clinging to the steel towers used to support power lines.
81,28,"It sends out electromagnetic waves, which let it float through the air. Touching it while it’s eating electricity will give you a full-body shock."
81,29,"It’s frequently the cause of power outages, which is why some power plants send out electrical signals that it can’t stand."
81,30,"Perhaps because electrical lines are often buried these days, the number of Magnemite attacks on power plants has increased."
81,31,It is hatched with the ability to defy gravity. It floats while emitting powerful electromagnetic waves.
81,33,"At times, Magnemite runs out of electricity and ends up on the ground. If you give batteries to a grounded Magnemite, it’ll start moving again."
81,34,"It subsists on electricity. As Magnemite flies, it emits electromagnetic waves from the units on each side of its body."
82,1,Formed by several MAGNEMITEs linked together. Theyfrequently appear when sunspots flare up.
82,3,"Generates strange radio signals. It raises the tem­perature by 3.6F degrees within 3,300 feet."
82,4,Three MAGNEMITE are linked by a strong magneticforce. Earaches will occur if you get too close.
82,5,"The MAGNEMITE are united by a mag­ netism so power­ful, it dries all moisture in its vicinities."
82,6,"When many MAGNETON gather together, theresulting magnetic storm disrupts radio waves."
82,7,"MAGNETON emits a powerful magnetic force that is fatal to mechanical devices. As a result, large cities soundsirens to warn citizens of large-scale outbreaks of this POKéMON."
82,8,"MAGNETON emits a powerful magnetic force that is fatal to electronics and precision instruments. Because ofthis, it is said that some towns warn people to keep this POKéMON inside a POKé BALL."
82,9,"It is actually three MAGNEMITE linked by magnetism. It generates powerful radio waves that raise temperatures by 3.6 degrees F within a 3,300-foot radius."
82,10,A linked cluster formed of several MAGNEMITE. It discharges powerful magnetic waves at high voltage.
82,11,Formed by several MAGNEMITE linked together. They frequently appear when sunspots flare up.
82,12,It is actually three MAGNEMITE linked by magnetism. A group can set off a magnetic storm.
82,14,Many mysteriously appear when more sunspots dot the sun. They stop TV sets from displaying properly.
82,15,Three MAGNEMITE are linked by a strong magnetic force. Earaches will occur if you get too close.
82,16,"The MAGNEMITE are united by a magnetism so powerful, it dries all moisture in its vicinity."
82,21,The stronger electromagnetic waves from the three linked Magnemite are enough to dry out surrounding moisture.
82,23,A linked cluster formed of several Magnemite. It discharges powerful magnetic waves at high voltage.
82,24,"Generates strange radio signals. It raises the temperature by 3.6 degrees Fahrenheit within 3,300 feet."
82,25,"Magneton emits a powerful magnetic force that is fatal to mechanical devices. As a result, large cities sound sirens to warn citizens of large-scale outbreaks of this Pokémon."
82,26,"Magneton emits a powerful magnetic force that is fatal to electronics and precision instruments. Because of this, it is said that some towns warn people to keep this Pokémon inside a Poké Ball."
82,27,"When three Magnemite link together, their brains also become one. They do not become three times more intelligent."
82,28,"It has about three times the electrical power of Magnemite. For some reason, outbreaks of this Pokémon happen when lots of sunspots appear."
82,29,"Delicate equipment can malfunction in areas inhabited by Magneton, which send out mysterious electrical signals."
82,30,"When rain clouds form, many Magneton gather in high places to wait for lightning to strike."
82,33,This Pokémon is three Magnemite that have linked together. Magneton sends out powerful radio waves to study its surroundings.
82,34,This Pokémon is constantly putting out a powerful magnetic force. Most computers go haywire when a Magneton approaches.
83,1,The sprig of green onions it holds is itsweapon. It is used much like a metal sword.
83,3,"Lives where reedy plants grow. They are rarely seen,so it's thought their numbers are decreasing."
83,4,"If anyone tries to disturb where the essential plantsticks grow, it uses its own stick to thwart them."
83,5,"If it eats the plant stick it carries as emer­gency rations, it runs off in search of a new stick."
83,6,"In order to pre­ vent their extinction, morepeople have made an effort to breed these POKéMON."
83,7,"FARFETCH’D is always seen with a stick from a plant of some sort. Apparently, there are good sticks and bad sticks.This POKéMON has been known to fight with others over sticks."
83,9,"It is always seen with a stick from a plant. Apparently, there are good sticks and bad sticks. This POKéMON occasionally fights with others over choice sticks."
83,10,It always walks about with a plant stalk clamped in its beak. The stalk is used for building its nest.
83,11,The plant stalk it holds is its weapon. The stalk is used like a sword to cut all sorts of things.
83,12,It can’t live without the stalk it holds. That’s why it defends the stalk from attackers with its life.
83,15,"If anyone tries to disturb where the essential plant stalks grow, it uses its own stalk to thwart them."
83,16,"If it eats the plant stalk it carries as emergency rations, it runs off in search of a new stalk."
83,25,"Farfetch’d is always seen with a stalk from a plant of some sort. Apparently, there are good stalks and bad stalks. This Pokémon has been known to fight with others over stalks."
83,31,"They live where reedy plants grow. Farfetch’d are rarely seen, so it’s thought their numbers are decreasing."
83,33,"The stalk this Pokémon carries in its wings serves as a sword to cut down opponents. In a dire situation, the stalk can also serve as food."
83,34,"They use a plant stalk as a weapon, but not all of them use it in the same way. Several distinct styles of stalk fighting have been observed."
84,1,A bird that makes up for its poor flying with itsfast foot speed. Leaves giant footprints.
84,3,"Its short wings make flying dif­ ficult. Instead,this POKéMON runs at high speed on developed legs."
84,4,"By alternately raising and lower­ ing its two heads,it balances itself to be more stable while running."
84,5,"It races through grassy plains with powerful strides,leaving footprints up to four inches deep."
84,6,"It lives on a grassy plain where it can see a longway. If it sees an enemy, it runs away at 60 mph."
84,7,"DODUO’s two heads never sleep at the same time. Its two heads take turns sleeping,so one head can always keep watch for enemies while the other one sleeps."
84,8,"DODUO’s two heads contain completely identical brains. A scientific study reported that onrare occasions, there will be examples of this POKéMON possessing different sets of brains."
84,9,"Even while eating or sleeping, one of the heads remains always vigilant for any sign of danger. When threatened, it flees at over 60 miles per hour."
84,10,A two-headed POKéMON that was discovered as a sudden mutation. It runs at a pace of over 60 miles per hour.
84,11,A bird that makes up for its poor flying with its fast foot speed. Leaves giant footprints.
84,12,The brains in its two heads appear to communicate emotions to each other with a telepathic power.
84,15,"By alternately raising and lowering its two heads, it balances itself to be more stable while running."
84,16,"It races through grassy plains with powerful strides, leaving footprints up to four inches deep."
84,23,A two-headed Pokémon that was discovered as a sudden mutation. It runs at a pace of over 60 miles per hour.
84,25,"Doduo’s two heads never sleep at the same time. Its two heads take turns sleeping, so one head can always keep watch for enemies while the other one sleeps."
84,26,"Doduo’s two heads contain completely identical brains. A scientific study reported that on rare occasions, there will be examples of this Pokémon possessing different sets of brains."
84,31,"Its short wings make flying difficult. Instead, this Pokémon runs at high speed on developed legs."
85,1,"Uses its three brains to execute complex plans.While two heads sleep, one head stays awake."
85,3,One of DODUO's 2 heads splits to form a uniquespecies. It runs close to 40 MPH in prairies.
85,4,"It collects data  and plans three times as wisely,but it may think too much and be­ come immobilized."
85,5,"If one of the heads gets to eat, the others will besatisfied, too, and they will stop squabbling."
85,6,An enemy that takes its eyes off any of the threeheads--even for a second--will get pecked severely.
85,7,Watch out if DODRIO’s three heads are looking in three separate directions. It’s a sure sign that it is on its guard.Don’t go near this POKéMON if it’s being wary - it may decide to peck you.
85,8,"Apparently, the heads aren’t the only parts of the body that DODRIO has three of.It has three sets of hearts and lungs as well, so it is capable of running long distances without rest."
85,9,A peculiar POKéMON species with three heads. It vigorously races across grassy plains even in arid seasons with little rainfall.
85,10,"An odd species that is rarely found. The three heads respectively represent joy, sadness, and anger."
85,11,"Uses its three brains to execute complex plans. While two heads sleep, one head is said to stay awake."
85,12,"When DODUO evolves into this odd breed, one of its heads splits into two. It runs at nearly 40 mph."
85,15,"It collects data and plans three times as wisely, but it may think too much and fall into a state of immobility."
85,16,"If one of the heads gets to eat, the others will be satisfied, too, and they will stop squabbling."
85,17,"When Doduo evolves into this odd breed, one of its heads splits into two. It runs at nearly 40 mph."
85,23,An enemy that takes its eyes off any of the three heads--even for a second--will get pecked severely.
85,25,Watch out if Dodrio’s three heads are looking in three separate directions. It’s a sure sign that it is on its guard. Don’t go near this Pokémon if it’s being wary—it may decide to peck you.
85,26,"Apparently, the heads aren’t the only parts of the body that Dodrio has three of. It has three sets of hearts and lungs as well, so it is capable of running long distances without rest."
85,31,One of Doduo’s two heads splits to form a unique species. It runs close to 40 mph in prairies.
86,1,The protruding horn on its head is very hard.It is used for bashing through thick ice.
86,3,Loves freezing cold conditions. Relishes swimmingin a frigid cli­ mate of around 14F degrees.
86,4,"Although it can't walk well on land, it is a gracefulswimmer. It espe­ cially loves being in frigid seas."
86,5,"In daytime, it is often found asleep on the seabed inshallow waters. Its nostrils close while it swims."
86,6,The light blue fur that covers it keeps it protectedagainst the cold. It loves iceberg- filled oceans.
86,7,"SEEL hunts for prey in the frigid sea underneath sheets of ice. When it needs to breathe, it punchesa hole through the ice with the sharply protruding section of its head."
86,9,"SEEL hunt for prey in frigid, ice-covered seas. When it needs to breathe, it punches a hole through the ice with the sharply protruding section of its head."
86,10,"Covered with light blue fur, its hide is thick and tough. It is active in bitter cold of minus 40 degrees Fahrenheit."
86,11,The protruding horn on its head is very hard. It is used for bashing through thick icebergs.
86,12,A Pokémon that lives on icebergs. It swims in the sea using the point on its head to break up ice.
86,15,"Although it can’t walk well on land, it is a graceful swimmer. It especially loves being in frigid seas."
86,16,"In daytime, it is often found asleep on the seabed in shallow waters. Its nostrils close while it swims."
86,21,"The colder it gets, the better it feels. It joyfully swims around oceans so cold that they are filled with floating ice."
86,24,"Covered with light blue fur, its hide is thick and tough. It is active in bitter cold of -40 degrees Fahrenheit."
86,25,"Seel hunts for prey in the frigid sea underneath sheets of ice. When it needs to breathe, it punches a hole through the ice with the sharply protruding section of its head."
86,29,It has always been supposed that Seel live only in cold seas. Their having shown up in Alola is a mystery.
86,30,"Thanks to its thick fat, cold seas don’t bother it at all, but it gets tired pretty easily in warm waters."
86,31,Loves freezing-cold conditions. Relishes swimming in a frigid climate of around 14 degrees Fahrenheit.
87,1,Stores thermal energy in its body. Swims at asteady 8 knots even in intensely cold waters.
87,3,"Its entire body is a snowy-white. Unharmed by evenintense cold, it swims powerfully in icy waters."
87,4,"Its streamlined body has little drag in water.The colder the temperature, the friskier it gets."
87,5,It loves frigid seas with ice floes. It uses itslong tail to change swimming direction quickly.
87,6,"It sleeps under shallow ocean waters during theday, then looks for food at night when it's cold."
